"Status","Start Time","Stop Time","Duration in ms","Parent Suite","Suite","Sub Suite","Test Class","Test Method","Name","Description"
"passed","Thu Aug 12 06:16:31 UTC 2021","Thu Aug 12 06:16:31 UTC 2021","464","","Windows page","","Windows page","should open new window tab after click","should open new window tab after click",""
"passed","Thu Aug 12 06:16:31 UTC 2021","Thu Aug 12 06:16:32 UTC 2021","956","","Form Authentication","","Form Authentication","should login with valid credentials","should login with valid credentials",""
"passed","Thu Aug 12 06:16:32 UTC 2021","Thu Aug 12 06:16:32 UTC 2021","600","","Form Authentication","","Form Authentication","displays warning message with invalid credentials","displays warning message with invalid credentials",""
"passed","Thu Aug 12 06:16:33 UTC 2021","Thu Aug 12 06:16:34 UTC 2021","586","","Windows page","","Windows page","should contain 'New Window' title","should contain 'New Window' title",""
"passed","Thu Aug 12 06:16:38 UTC 2021","Thu Aug 12 06:16:38 UTC 2021","436","","File upload","","File upload","is successful","is successful",""
