"Status","Start Time","Stop Time","Duration in ms","Parent Suite","Suite","Sub Suite","Test Class","Test Method","Name","Description"
"passed","Mon Oct 26 03:22:53 UTC 2020","Mon Oct 26 03:22:54 UTC 2020","947","","Windows page","","Windows page","should open new window tab after click","should open new window tab after click",""
"passed","Mon Oct 26 03:22:55 UTC 2020","Mon Oct 26 03:22:55 UTC 2020","731","","Form Authentication","","Form Authentication","displays warning message with invalid credentials","displays warning message with invalid credentials",""
"passed","Mon Oct 26 03:22:52 UTC 2020","Mon Oct 26 03:22:53 UTC 2020","1290","","File upload","","File upload","is successful","is successful",""
"passed","Mon Oct 26 03:22:55 UTC 2020","Mon Oct 26 03:22:56 UTC 2020","504","","Windows page","","Windows page","should contain 'New Window' title","should contain 'New Window' title",""
"passed","Mon Oct 26 03:22:53 UTC 2020","Mon Oct 26 03:22:55 UTC 2020","1311","","Form Authentication","","Form Authentication","should login with valid credentials","should login with valid credentials",""
