"Status","Start Time","Stop Time","Duration in ms","Parent Suite","Suite","Sub Suite","Test Class","Test Method","Name","Description"
"passed","Sat Feb 20 15:44:08 UTC 2021","Sat Feb 20 15:44:09 UTC 2021","836","","File upload","","File upload","is successful","is successful",""
"passed","Sat Feb 20 15:44:01 UTC 2021","Sat Feb 20 15:44:03 UTC 2021","1611","","Form Authentication","","Form Authentication","should login with valid credentials","should login with valid credentials",""
"passed","Sat Feb 20 15:44:01 UTC 2021","Sat Feb 20 15:44:02 UTC 2021","790","","Windows page","","Windows page","should open new window tab after click","should open new window tab after click",""
"passed","Sat Feb 20 15:44:03 UTC 2021","Sat Feb 20 15:44:04 UTC 2021","656","","Form Authentication","","Form Authentication","displays warning message with invalid credentials","displays warning message with invalid credentials",""
"passed","Sat Feb 20 15:44:04 UTC 2021","Sat Feb 20 15:44:05 UTC 2021","720","","Windows page","","Windows page","should contain 'New Window' title","should contain 'New Window' title",""
