"Status","Start Time","Stop Time","Duration in ms","Parent Suite","Suite","Sub Suite","Test Class","Test Method","Name","Description"
"passed","Thu Oct 29 03:22:21 UTC 2020","Thu Oct 29 03:22:21 UTC 2020","333","","Windows page","","Windows page","should contain 'New Window' title","should contain 'New Window' title",""
"passed","Thu Oct 29 03:22:18 UTC 2020","Thu Oct 29 03:22:20 UTC 2020","1442","","Form Authentication","","Form Authentication","should login with valid credentials","should login with valid credentials",""
"passed","Thu Oct 29 03:22:18 UTC 2020","Thu Oct 29 03:22:19 UTC 2020","641","","Windows page","","Windows page","should open new window tab after click","should open new window tab after click",""
"passed","Thu Oct 29 03:22:18 UTC 2020","Thu Oct 29 03:22:19 UTC 2020","1034","","File upload","","File upload","is successful","is successful",""
"passed","Thu Oct 29 03:22:20 UTC 2020","Thu Oct 29 03:22:20 UTC 2020","545","","Form Authentication","","Form Authentication","displays warning message with invalid credentials","displays warning message with invalid credentials",""
