"Status","Start Time","Stop Time","Duration in ms","Parent Suite","Suite","Sub Suite","Test Class","Test Method","Name","Description"
"passed","Fri Feb 19 02:22:55 UTC 2021","Fri Feb 19 02:22:56 UTC 2021","1284","","Form Authentication","","Form Authentication","displays warning message with invalid credentials","displays warning message with invalid credentials",""
"passed","Fri Feb 19 02:22:54 UTC 2021","Fri Feb 19 02:22:55 UTC 2021","771","","Windows page","","Windows page","should open new window tab after click","should open new window tab after click",""
"passed","Fri Feb 19 02:22:57 UTC 2021","Fri Feb 19 02:22:57 UTC 2021","377","","Windows page","","Windows page","should contain 'New Window' title","should contain 'New Window' title",""
"passed","Fri Feb 19 02:22:54 UTC 2021","Fri Feb 19 02:22:55 UTC 2021","1673","","Form Authentication","","Form Authentication","should login with valid credentials","should login with valid credentials",""
"passed","Fri Feb 19 02:22:55 UTC 2021","Fri Feb 19 02:22:56 UTC 2021","1187","","File upload","","File upload","is successful","is successful",""
