"Status","Start Time","Stop Time","Duration in ms","Parent Suite","Suite","Sub Suite","Test Class","Test Method","Name","Description"
"passed","Tue Apr 06 02:41:46 UTC 2021","Tue Apr 06 02:41:47 UTC 2021","1105","","Form Authentication","","Form Authentication","should login with valid credentials","should login with valid credentials",""
"passed","Tue Apr 06 02:41:47 UTC 2021","Tue Apr 06 02:41:48 UTC 2021","686","","Form Authentication","","Form Authentication","displays warning message with invalid credentials","displays warning message with invalid credentials",""
"passed","Tue Apr 06 02:41:53 UTC 2021","Tue Apr 06 02:41:53 UTC 2021","515","","File upload","","File upload","is successful","is successful",""
"passed","Tue Apr 06 02:41:49 UTC 2021","Tue Apr 06 02:41:49 UTC 2021","810","","Windows page","","Windows page","should contain 'New Window' title","should contain 'New Window' title",""
"passed","Tue Apr 06 02:41:46 UTC 2021","Tue Apr 06 02:41:47 UTC 2021","550","","Windows page","","Windows page","should open new window tab after click","should open new window tab after click",""
