"Status","Start Time","Stop Time","Duration in ms","Parent Suite","Suite","Sub Suite","Test Class","Test Method","Name","Description"
"passed","Sat Feb 27 02:25:04 UTC 2021","Sat Feb 27 02:25:05 UTC 2021","1118","","Form Authentication","","Form Authentication","should login with valid credentials","should login with valid credentials",""
"passed","Sat Feb 27 02:25:05 UTC 2021","Sat Feb 27 02:25:06 UTC 2021","661","","Form Authentication","","Form Authentication","displays warning message with invalid credentials","displays warning message with invalid credentials",""
"passed","Sat Feb 27 02:25:10 UTC 2021","Sat Feb 27 02:25:11 UTC 2021","475","","File upload","","File upload","is successful","is successful",""
"passed","Sat Feb 27 02:25:06 UTC 2021","Sat Feb 27 02:25:07 UTC 2021","536","","Windows page","","Windows page","should contain 'New Window' title","should contain 'New Window' title",""
"passed","Sat Feb 27 02:25:04 UTC 2021","Sat Feb 27 02:25:04 UTC 2021","501","","Windows page","","Windows page","should open new window tab after click","should open new window tab after click",""
