"Status","Start Time","Stop Time","Duration in ms","Parent Suite","Suite","Sub Suite","Test Class","Test Method","Name","Description"
"passed","Sun Jan 17 03:14:21 UTC 2021","Sun Jan 17 03:14:22 UTC 2021","1474","","Form Authentication","","Form Authentication","should login with valid credentials","should login with valid credentials",""
"passed","Sun Jan 17 03:14:22 UTC 2021","Sun Jan 17 03:14:23 UTC 2021","557","","Windows page","","Windows page","should contain 'New Window' title","should contain 'New Window' title",""
"passed","Sun Jan 17 03:14:19 UTC 2021","Sun Jan 17 03:14:20 UTC 2021","615","","Windows page","","Windows page","should open new window tab after click","should open new window tab after click",""
"passed","Sun Jan 17 03:14:21 UTC 2021","Sun Jan 17 03:14:22 UTC 2021","950","","File upload","","File upload","is successful","is successful",""
"passed","Sun Jan 17 03:14:22 UTC 2021","Sun Jan 17 03:14:23 UTC 2021","836","","Form Authentication","","Form Authentication","displays warning message with invalid credentials","displays warning message with invalid credentials",""
