"Status","Start Time","Stop Time","Duration in ms","Parent Suite","Suite","Sub Suite","Test Class","Test Method","Name","Description"
"passed","Sun Jun 06 06:43:26 UTC 2021","Sun Jun 06 06:43:27 UTC 2021","449","","Windows page","","Windows page","should open new window tab after click","should open new window tab after click",""
"passed","Sun Jun 06 06:43:29 UTC 2021","Sun Jun 06 06:43:29 UTC 2021","509","","Windows page","","Windows page","should contain 'New Window' title","should contain 'New Window' title",""
"passed","Sun Jun 06 06:43:27 UTC 2021","Sun Jun 06 06:43:28 UTC 2021","683","","Form Authentication","","Form Authentication","displays warning message with invalid credentials","displays warning message with invalid credentials",""
"passed","Sun Jun 06 06:43:33 UTC 2021","Sun Jun 06 06:43:33 UTC 2021","494","","File upload","","File upload","is successful","is successful",""
"passed","Sun Jun 06 06:43:26 UTC 2021","Sun Jun 06 06:43:27 UTC 2021","1043","","Form Authentication","","Form Authentication","should login with valid credentials","should login with valid credentials",""
