"Status","Start Time","Stop Time","Duration in ms","Parent Suite","Suite","Sub Suite","Test Class","Test Method","Name","Description"
"passed","Fri Jun 11 06:15:00 UTC 2021","Fri Jun 11 06:15:02 UTC 2021","1814","","Form Authentication","","Form Authentication","should login with valid credentials","should login with valid credentials",""
"passed","Fri Jun 11 06:15:03 UTC 2021","Fri Jun 11 06:15:04 UTC 2021","1163","","Windows page","","Windows page","should contain 'New Window' title","should contain 'New Window' title",""
"passed","Fri Jun 11 06:15:00 UTC 2021","Fri Jun 11 06:15:01 UTC 2021","1063","","Windows page","","Windows page","should open new window tab after click","should open new window tab after click",""
"passed","Fri Jun 11 06:15:02 UTC 2021","Fri Jun 11 06:15:03 UTC 2021","867","","Form Authentication","","Form Authentication","displays warning message with invalid credentials","displays warning message with invalid credentials",""
"passed","Fri Jun 11 06:15:08 UTC 2021","Fri Jun 11 06:15:09 UTC 2021","1294","","File upload","","File upload","is successful","is successful",""
