"Status","Start Time","Stop Time","Duration in ms","Parent Suite","Suite","Sub Suite","Test Class","Test Method","Name","Description"
"passed","Fri Jun 04 07:44:18 UTC 2021","Fri Jun 04 07:44:19 UTC 2021","1080","","Form Authentication","","Form Authentication","displays warning message with invalid credentials","displays warning message with invalid credentials",""
"passed","Fri Jun 04 07:44:20 UTC 2021","Fri Jun 04 07:44:21 UTC 2021","1110","","Windows page","","Windows page","should contain 'New Window' title","should contain 'New Window' title",""
"passed","Fri Jun 04 07:44:16 UTC 2021","Fri Jun 04 07:44:18 UTC 2021","1835","","Windows page","","Windows page","should open new window tab after click","should open new window tab after click",""
"passed","Fri Jun 04 07:44:24 UTC 2021","Fri Jun 04 07:44:25 UTC 2021","1130","","File upload","","File upload","is successful","is successful",""
"passed","Fri Jun 04 07:44:16 UTC 2021","Fri Jun 04 07:44:18 UTC 2021","1629","","Form Authentication","","Form Authentication","should login with valid credentials","should login with valid credentials",""
