"Status","Start Time","Stop Time","Duration in ms","Parent Suite","Suite","Sub Suite","Test Class","Test Method","Name","Description"
"passed","Tue Oct 06 03:19:34 UTC 2020","Tue Oct 06 03:19:35 UTC 2020","1113","","File upload","","File upload","is successful","is successful",""
"passed","Tue Oct 06 03:19:37 UTC 2020","Tue Oct 06 03:19:37 UTC 2020","355","","Windows page","","Windows page","should contain 'New Window' title","should contain 'New Window' title",""
"passed","Tue Oct 06 03:19:34 UTC 2020","Tue Oct 06 03:19:35 UTC 2020","792","","Windows page","","Windows page","should open new window tab after click","should open new window tab after click",""
"passed","Tue Oct 06 03:19:34 UTC 2020","Tue Oct 06 03:19:36 UTC 2020","1554","","Form Authentication","","Form Authentication","should login with valid credentials","should login with valid credentials",""
"passed","Tue Oct 06 03:19:36 UTC 2020","Tue Oct 06 03:19:36 UTC 2020","689","","Form Authentication","","Form Authentication","displays warning message with invalid credentials","displays warning message with invalid credentials",""
