"Status","Start Time","Stop Time","Duration in ms","Parent Suite","Suite","Sub Suite","Test Class","Test Method","Name","Description"
"passed","Wed Apr 28 06:21:00 UTC 2021","Wed Apr 28 06:21:01 UTC 2021","1041","","Windows page","","Windows page","should contain 'New Window' title","should contain 'New Window' title",""
"passed","Wed Apr 28 06:20:57 UTC 2021","Wed Apr 28 06:20:59 UTC 2021","1778","","Form Authentication","","Form Authentication","should login with valid credentials","should login with valid credentials",""
"passed","Wed Apr 28 06:20:57 UTC 2021","Wed Apr 28 06:20:58 UTC 2021","997","","Windows page","","Windows page","should open new window tab after click","should open new window tab after click",""
"passed","Wed Apr 28 06:21:05 UTC 2021","Wed Apr 28 06:21:06 UTC 2021","1930","","File upload","","File upload","is successful","is successful",""
"passed","Wed Apr 28 06:20:59 UTC 2021","Wed Apr 28 06:21:00 UTC 2021","852","","Form Authentication","","Form Authentication","displays warning message with invalid credentials","displays warning message with invalid credentials",""
