"Status","Start Time","Stop Time","Duration in ms","Parent Suite","Suite","Sub Suite","Test Class","Test Method","Name","Description"
"passed","Sun Dec 06 02:20:36 UTC 2020","Sun Dec 06 02:20:37 UTC 2020","542","","Windows page","","Windows page","should open new window tab after click","should open new window tab after click",""
"passed","Sun Dec 06 02:20:35 UTC 2020","Sun Dec 06 02:20:36 UTC 2020","889","","File upload","","File upload","is successful","is successful",""
"passed","Sun Dec 06 02:20:36 UTC 2020","Sun Dec 06 02:20:37 UTC 2020","1241","","Form Authentication","","Form Authentication","should login with valid credentials","should login with valid credentials",""
"passed","Sun Dec 06 02:20:37 UTC 2020","Sun Dec 06 02:20:38 UTC 2020","601","","Form Authentication","","Form Authentication","displays warning message with invalid credentials","displays warning message with invalid credentials",""
"passed","Sun Dec 06 02:20:38 UTC 2020","Sun Dec 06 02:20:38 UTC 2020","266","","Windows page","","Windows page","should contain 'New Window' title","should contain 'New Window' title",""
