"Status","Start Time","Stop Time","Duration in ms","Parent Suite","Suite","Sub Suite","Test Class","Test Method","Name","Description"
"passed","Mon Nov 16 02:15:34 UTC 2020","Mon Nov 16 02:15:35 UTC 2020","1252","","File upload","","File upload","is successful","is successful",""
"passed","Mon Nov 16 02:15:32 UTC 2020","Mon Nov 16 02:15:33 UTC 2020","1124","","Form Authentication","","Form Authentication","should login with valid credentials","should login with valid credentials",""
"passed","Mon Nov 16 02:15:34 UTC 2020","Mon Nov 16 02:15:35 UTC 2020","668","","Windows page","","Windows page","should open new window tab after click","should open new window tab after click",""
"passed","Mon Nov 16 02:15:33 UTC 2020","Mon Nov 16 02:15:34 UTC 2020","834","","Form Authentication","","Form Authentication","displays warning message with invalid credentials","displays warning message with invalid credentials",""
"passed","Mon Nov 16 02:15:36 UTC 2020","Mon Nov 16 02:15:36 UTC 2020","420","","Windows page","","Windows page","should contain 'New Window' title","should contain 'New Window' title",""
