"Status","Start Time","Stop Time","Duration in ms","Parent Suite","Suite","Sub Suite","Test Class","Test Method","Name","Description"
"passed","Tue Oct 20 03:21:17 UTC 2020","Tue Oct 20 03:21:19 UTC 2020","1836","","Form Authentication","","Form Authentication","should login with valid credentials","should login with valid credentials",""
"passed","Tue Oct 20 03:21:20 UTC 2020","Tue Oct 20 03:21:20 UTC 2020","472","","Windows page","","Windows page","should contain 'New Window' title","should contain 'New Window' title",""
"passed","Tue Oct 20 03:21:17 UTC 2020","Tue Oct 20 03:21:18 UTC 2020","940","","Windows page","","Windows page","should open new window tab after click","should open new window tab after click",""
"passed","Tue Oct 20 03:21:16 UTC 2020","Tue Oct 20 03:21:18 UTC 2020","1737","","File upload","","File upload","is successful","is successful",""
"passed","Tue Oct 20 03:21:19 UTC 2020","Tue Oct 20 03:21:20 UTC 2020","781","","Form Authentication","","Form Authentication","displays warning message with invalid credentials","displays warning message with invalid credentials",""
