"Status","Start Time","Stop Time","Duration in ms","Parent Suite","Suite","Sub Suite","Test Class","Test Method","Name","Description"
"passed","Mon Jun 07 07:32:15 UTC 2021","Mon Jun 07 07:32:17 UTC 2021","1156","","File upload","","File upload","is successful","is successful",""
"passed","Mon Jun 07 07:32:09 UTC 2021","Mon Jun 07 07:32:10 UTC 2021","1595","","Form Authentication","","Form Authentication","should login with valid credentials","should login with valid credentials",""
"passed","Mon Jun 07 07:32:09 UTC 2021","Mon Jun 07 07:32:10 UTC 2021","976","","Windows page","","Windows page","should open new window tab after click","should open new window tab after click",""
"passed","Mon Jun 07 07:32:11 UTC 2021","Mon Jun 07 07:32:13 UTC 2021","2091","","Windows page","","Windows page","should contain 'New Window' title","should contain 'New Window' title",""
"passed","Mon Jun 07 07:32:10 UTC 2021","Mon Jun 07 07:32:11 UTC 2021","740","","Form Authentication","","Form Authentication","displays warning message with invalid credentials","displays warning message with invalid credentials",""
