"Status","Start Time","Stop Time","Duration in ms","Parent Suite","Suite","Sub Suite","Test Class","Test Method","Name","Description"
"passed","Mon May 10 06:16:07 UTC 2021","Mon May 10 06:16:08 UTC 2021","1160","","File upload","","File upload","is successful","is successful",""
"passed","Mon May 10 06:16:01 UTC 2021","Mon May 10 06:16:01 UTC 2021","862","","Form Authentication","","Form Authentication","displays warning message with invalid credentials","displays warning message with invalid credentials",""
"passed","Mon May 10 06:15:59 UTC 2021","Mon May 10 06:16:01 UTC 2021","2110","","Form Authentication","","Form Authentication","should login with valid credentials","should login with valid credentials",""
"passed","Mon May 10 06:16:02 UTC 2021","Mon May 10 06:16:03 UTC 2021","1147","","Windows page","","Windows page","should contain 'New Window' title","should contain 'New Window' title",""
"passed","Mon May 10 06:15:59 UTC 2021","Mon May 10 06:16:00 UTC 2021","1036","","Windows page","","Windows page","should open new window tab after click","should open new window tab after click",""
