"Status","Start Time","Stop Time","Duration in ms","Parent Suite","Suite","Sub Suite","Test Class","Test Method","Name","Description"
"passed","Tue Dec 08 02:22:04 UTC 2020","Tue Dec 08 02:22:05 UTC 2020","578","","Windows page","","Windows page","should open new window tab after click","should open new window tab after click",""
"passed","Tue Dec 08 02:22:07 UTC 2020","Tue Dec 08 02:22:08 UTC 2020","948","","Windows page","","Windows page","should contain 'New Window' title","should contain 'New Window' title",""
"passed","Tue Dec 08 02:22:06 UTC 2020","Tue Dec 08 02:22:07 UTC 2020","955","","Form Authentication","","Form Authentication","displays warning message with invalid credentials","displays warning message with invalid credentials",""
"passed","Tue Dec 08 02:22:04 UTC 2020","Tue Dec 08 02:22:06 UTC 2020","1774","","Form Authentication","","Form Authentication","should login with valid credentials","should login with valid credentials",""
"passed","Tue Dec 08 02:22:06 UTC 2020","Tue Dec 08 02:22:07 UTC 2020","1079","","File upload","","File upload","is successful","is successful",""
