"Status","Start Time","Stop Time","Duration in ms","Parent Suite","Suite","Sub Suite","Test Class","Test Method","Name","Description"
"passed","Sun May 30 07:11:20 UTC 2021","Sun May 30 07:11:20 UTC 2021","455","","File upload","","File upload","is successful","is successful",""
"passed","Sun May 30 07:11:13 UTC 2021","Sun May 30 07:11:14 UTC 2021","448","","Windows page","","Windows page","should open new window tab after click","should open new window tab after click",""
"passed","Sun May 30 07:11:14 UTC 2021","Sun May 30 07:11:14 UTC 2021","986","","Form Authentication","","Form Authentication","should login with valid credentials","should login with valid credentials",""
"passed","Sun May 30 07:11:16 UTC 2021","Sun May 30 07:11:16 UTC 2021","455","","Windows page","","Windows page","should contain 'New Window' title","should contain 'New Window' title",""
"passed","Sun May 30 07:11:14 UTC 2021","Sun May 30 07:11:15 UTC 2021","628","","Form Authentication","","Form Authentication","displays warning message with invalid credentials","displays warning message with invalid credentials",""
