"Status","Start Time","Stop Time","Duration in ms","Parent Suite","Suite","Sub Suite","Test Class","Test Method","Name","Description"
"passed","Sun Mar 14 02:33:23 UTC 2021","Sun Mar 14 02:33:24 UTC 2021","519","","Windows page","","Windows page","should open new window tab after click","should open new window tab after click",""
"passed","Sun Mar 14 02:33:23 UTC 2021","Sun Mar 14 02:33:24 UTC 2021","1064","","Form Authentication","","Form Authentication","should login with valid credentials","should login with valid credentials",""
"passed","Sun Mar 14 02:33:26 UTC 2021","Sun Mar 14 02:33:26 UTC 2021","464","","Windows page","","Windows page","should contain 'New Window' title","should contain 'New Window' title",""
"passed","Sun Mar 14 02:33:30 UTC 2021","Sun Mar 14 02:33:30 UTC 2021","516","","File upload","","File upload","is successful","is successful",""
"passed","Sun Mar 14 02:33:24 UTC 2021","Sun Mar 14 02:33:25 UTC 2021","678","","Form Authentication","","Form Authentication","displays warning message with invalid credentials","displays warning message with invalid credentials",""
