"Status","Start Time","Stop Time","Duration in ms","Parent Suite","Suite","Sub Suite","Test Class","Test Method","Name","Description"
"passed","Tue May 11 06:15:51 UTC 2021","Tue May 11 06:15:52 UTC 2021","1063","","Windows page","","Windows page","should contain 'New Window' title","should contain 'New Window' title",""
"passed","Tue May 11 06:15:49 UTC 2021","Tue May 11 06:15:50 UTC 2021","1009","","Form Authentication","","Form Authentication","displays warning message with invalid credentials","displays warning message with invalid credentials",""
"passed","Tue May 11 06:15:47 UTC 2021","Tue May 11 06:15:49 UTC 2021","1716","","Form Authentication","","Form Authentication","should login with valid credentials","should login with valid credentials",""
"passed","Tue May 11 06:15:55 UTC 2021","Tue May 11 06:15:57 UTC 2021","1405","","File upload","","File upload","is successful","is successful",""
"passed","Tue May 11 06:15:47 UTC 2021","Tue May 11 06:15:49 UTC 2021","2105","","Windows page","","Windows page","should open new window tab after click","should open new window tab after click",""
