"Status","Start Time","Stop Time","Duration in ms","Parent Suite","Suite","Sub Suite","Test Class","Test Method","Name","Description"
"passed","Wed Sep 23 03:17:47 UTC 2020","Wed Sep 23 03:17:48 UTC 2020","1118","","Form Authentication","","Form Authentication","displays warning message with invalid credentials","displays warning message with invalid credentials",""
"passed","Wed Sep 23 03:17:47 UTC 2020","Wed Sep 23 03:17:48 UTC 2020","1246","","File upload","","File upload","is successful","is successful",""
"passed","Wed Sep 23 03:17:47 UTC 2020","Wed Sep 23 03:17:48 UTC 2020","898","","Windows page","","Windows page","should open new window tab after click","should open new window tab after click",""
"passed","Wed Sep 23 03:17:50 UTC 2020","Wed Sep 23 03:17:50 UTC 2020","379","","Windows page","","Windows page","should contain 'New Window' title","should contain 'New Window' title",""
"passed","Wed Sep 23 03:17:46 UTC 2020","Wed Sep 23 03:17:47 UTC 2020","1398","","Form Authentication","","Form Authentication","should login with valid credentials","should login with valid credentials",""
