"Status","Start Time","Stop Time","Duration in ms","Parent Suite","Suite","Sub Suite","Test Class","Test Method","Name","Description"
"passed","Fri Nov 13 02:15:07 UTC 2020","Fri Nov 13 02:15:07 UTC 2020","829","","Form Authentication","","Form Authentication","displays warning message with invalid credentials","displays warning message with invalid credentials",""
"passed","Fri Nov 13 02:15:05 UTC 2020","Fri Nov 13 02:15:07 UTC 2020","1751","","Form Authentication","","Form Authentication","should login with valid credentials","should login with valid credentials",""
"passed","Fri Nov 13 02:15:05 UTC 2020","Fri Nov 13 02:15:06 UTC 2020","1260","","File upload","","File upload","is successful","is successful",""
"passed","Fri Nov 13 02:15:04 UTC 2020","Fri Nov 13 02:15:05 UTC 2020","608","","Windows page","","Windows page","should open new window tab after click","should open new window tab after click",""
"passed","Fri Nov 13 02:15:07 UTC 2020","Fri Nov 13 02:15:08 UTC 2020","563","","Windows page","","Windows page","should contain 'New Window' title","should contain 'New Window' title",""
