"Status","Start Time","Stop Time","Duration in ms","Parent Suite","Suite","Sub Suite","Test Class","Test Method","Name","Description"
"passed","Sat Feb 06 02:21:03 UTC 2021","Sat Feb 06 02:21:04 UTC 2021","1193","","File upload","","File upload","is successful","is successful",""
"passed","Sat Feb 06 02:21:03 UTC 2021","Sat Feb 06 02:21:04 UTC 2021","1833","","Form Authentication","","Form Authentication","should login with valid credentials","should login with valid credentials",""
"passed","Sat Feb 06 02:21:05 UTC 2021","Sat Feb 06 02:21:06 UTC 2021","399","","Windows page","","Windows page","should contain 'New Window' title","should contain 'New Window' title",""
"passed","Sat Feb 06 02:21:04 UTC 2021","Sat Feb 06 02:21:05 UTC 2021","682","","Form Authentication","","Form Authentication","displays warning message with invalid credentials","displays warning message with invalid credentials",""
"passed","Sat Feb 06 02:21:02 UTC 2021","Sat Feb 06 02:21:03 UTC 2021","778","","Windows page","","Windows page","should open new window tab after click","should open new window tab after click",""
