"Status","Start Time","Stop Time","Duration in ms","Parent Suite","Suite","Sub Suite","Test Class","Test Method","Name","Description"
"passed","Sun Sep 06 22:16:13 UTC 2020","Sun Sep 06 22:16:15 UTC 2020","1355","","Form Authentication","","Form Authentication","should login with valid credentials","should login with valid credentials",""
"passed","Sun Sep 06 22:16:13 UTC 2020","Sun Sep 06 22:16:15 UTC 2020","1366","","Windows page","","Windows page","should open new window tab after click","should open new window tab after click",""
"passed","Sun Sep 06 22:16:15 UTC 2020","Sun Sep 06 22:16:16 UTC 2020","747","","Form Authentication","","Form Authentication","displays warning message with invalid credentials","displays warning message with invalid credentials",""
"passed","Sun Sep 06 22:16:16 UTC 2020","Sun Sep 06 22:16:17 UTC 2020","1021","","Windows page","","Windows page","should contain 'New Window' title","should contain 'New Window' title",""
"passed","Sun Sep 06 22:16:13 UTC 2020","Sun Sep 06 22:16:14 UTC 2020","1069","","File upload","","File upload","is successful","is successful",""
