"Status","Start Time","Stop Time","Duration in ms","Parent Suite","Suite","Sub Suite","Test Class","Test Method","Name","Description"
"passed","Sat Sep 12 03:16:46 UTC 2020","Sat Sep 12 03:16:46 UTC 2020","615","","Form Authentication","","Form Authentication","displays warning message with invalid credentials","displays warning message with invalid credentials",""
"passed","Sat Sep 12 03:16:44 UTC 2020","Sat Sep 12 03:16:46 UTC 2020","1446","","Form Authentication","","Form Authentication","should login with valid credentials","should login with valid credentials",""
"passed","Sat Sep 12 03:16:44 UTC 2020","Sat Sep 12 03:16:44 UTC 2020","779","","Windows page","","Windows page","should open new window tab after click","should open new window tab after click",""
"passed","Sat Sep 12 03:16:44 UTC 2020","Sat Sep 12 03:16:45 UTC 2020","1283","","File upload","","File upload","is successful","is successful",""
"passed","Sat Sep 12 03:16:46 UTC 2020","Sat Sep 12 03:16:47 UTC 2020","496","","Windows page","","Windows page","should contain 'New Window' title","should contain 'New Window' title",""
