"Status","Start Time","Stop Time","Duration in ms","Parent Suite","Suite","Sub Suite","Test Class","Test Method","Name","Description"
"passed","Thu Dec 24 02:42:49 UTC 2020","Thu Dec 24 02:42:49 UTC 2020","303","","Windows page","","Windows page","should contain 'New Window' title","should contain 'New Window' title",""
"passed","Thu Dec 24 02:42:47 UTC 2020","Thu Dec 24 02:42:48 UTC 2020","410","","Windows page","","Windows page","should open new window tab after click","should open new window tab after click",""
"passed","Thu Dec 24 02:42:45 UTC 2020","Thu Dec 24 02:42:46 UTC 2020","1400","","Form Authentication","","Form Authentication","should login with valid credentials","should login with valid credentials",""
"passed","Thu Dec 24 02:42:46 UTC 2020","Thu Dec 24 02:42:47 UTC 2020","1043","","File upload","","File upload","is successful","is successful",""
"passed","Thu Dec 24 02:42:46 UTC 2020","Thu Dec 24 02:42:47 UTC 2020","724","","Form Authentication","","Form Authentication","displays warning message with invalid credentials","displays warning message with invalid credentials",""
