"Status","Start Time","Stop Time","Duration in ms","Parent Suite","Suite","Sub Suite","Test Class","Test Method","Name","Description"
"passed","Tue Apr 20 06:21:00 UTC 2021","Tue Apr 20 06:21:01 UTC 2021","1048","","Form Authentication","","Form Authentication","should login with valid credentials","should login with valid credentials",""
"passed","Tue Apr 20 06:21:01 UTC 2021","Tue Apr 20 06:21:01 UTC 2021","622","","Form Authentication","","Form Authentication","displays warning message with invalid credentials","displays warning message with invalid credentials",""
"passed","Tue Apr 20 06:21:02 UTC 2021","Tue Apr 20 06:21:03 UTC 2021","482","","Windows page","","Windows page","should contain 'New Window' title","should contain 'New Window' title",""
"passed","Tue Apr 20 06:21:00 UTC 2021","Tue Apr 20 06:21:00 UTC 2021","609","","Windows page","","Windows page","should open new window tab after click","should open new window tab after click",""
"passed","Tue Apr 20 06:21:06 UTC 2021","Tue Apr 20 06:21:06 UTC 2021","479","","File upload","","File upload","is successful","is successful",""
