"Status","Start Time","Stop Time","Duration in ms","Parent Suite","Suite","Sub Suite","Test Class","Test Method","Name","Description"
"passed","Tue Mar 02 02:20:17 UTC 2021","Tue Mar 02 02:20:18 UTC 2021","628","","File upload","","File upload","is successful","is successful",""
"passed","Tue Mar 02 02:20:10 UTC 2021","Tue Mar 02 02:20:11 UTC 2021","1377","","Form Authentication","","Form Authentication","should login with valid credentials","should login with valid credentials",""
"passed","Tue Mar 02 02:20:12 UTC 2021","Tue Mar 02 02:20:13 UTC 2021","755","","Windows page","","Windows page","should contain 'New Window' title","should contain 'New Window' title",""
"passed","Tue Mar 02 02:20:11 UTC 2021","Tue Mar 02 02:20:12 UTC 2021","774","","Form Authentication","","Form Authentication","displays warning message with invalid credentials","displays warning message with invalid credentials",""
"passed","Tue Mar 02 02:20:10 UTC 2021","Tue Mar 02 02:20:10 UTC 2021","608","","Windows page","","Windows page","should open new window tab after click","should open new window tab after click",""
