"Status","Start Time","Stop Time","Duration in ms","Parent Suite","Suite","Sub Suite","Test Class","Test Method","Name","Description"
"passed","Sun Feb 14 02:23:08 UTC 2021","Sun Feb 14 02:23:09 UTC 2021","1115","","File upload","","File upload","is successful","is successful",""
"passed","Sun Feb 14 02:23:11 UTC 2021","Sun Feb 14 02:23:11 UTC 2021","333","","Windows page","","Windows page","should contain 'New Window' title","should contain 'New Window' title",""
"passed","Sun Feb 14 02:23:08 UTC 2021","Sun Feb 14 02:23:09 UTC 2021","1169","","Form Authentication","","Form Authentication","should login with valid credentials","should login with valid credentials",""
"passed","Sun Feb 14 02:23:08 UTC 2021","Sun Feb 14 02:23:09 UTC 2021","713","","Windows page","","Windows page","should open new window tab after click","should open new window tab after click",""
"passed","Sun Feb 14 02:23:09 UTC 2021","Sun Feb 14 02:23:10 UTC 2021","845","","Form Authentication","","Form Authentication","displays warning message with invalid credentials","displays warning message with invalid credentials",""
