"Status","Start Time","Stop Time","Duration in ms","Parent Suite","Suite","Sub Suite","Test Class","Test Method","Name","Description"
"passed","Wed Jun 09 06:24:37 UTC 2021","Wed Jun 09 06:24:38 UTC 2021","672","","Form Authentication","","Form Authentication","displays warning message with invalid credentials","displays warning message with invalid credentials",""
"passed","Wed Jun 09 06:24:36 UTC 2021","Wed Jun 09 06:24:37 UTC 2021","1149","","Form Authentication","","Form Authentication","should login with valid credentials","should login with valid credentials",""
"passed","Wed Jun 09 06:24:36 UTC 2021","Wed Jun 09 06:24:36 UTC 2021","505","","Windows page","","Windows page","should open new window tab after click","should open new window tab after click",""
"passed","Wed Jun 09 06:24:38 UTC 2021","Wed Jun 09 06:24:39 UTC 2021","553","","Windows page","","Windows page","should contain 'New Window' title","should contain 'New Window' title",""
"passed","Wed Jun 09 06:24:43 UTC 2021","Wed Jun 09 06:24:44 UTC 2021","547","","File upload","","File upload","is successful","is successful",""
